create at,username,tweet2021-01-02 15:22:45,marvinaaf,ko rangorang jkt pada dpt sms vaksin yah ini yang di cilegon ada yang dapet sms vaksin covid juga kah 
2021-01-02 15:22:44,Humble__kenyan,men mtakubali io covid vaccine idungwe kwa omuzigidi yenu 
2021-01-02 15:22:41,aishyoo,id karena pada vaksin sinovac terdapat booster alumunium saat ini pada kawan kawan dengan kita tunda be 
2021-01-02 15:22:39,aishyoo,id karena kebetulan bidang saya di alergi imunologi saya bahas sedikit yang terkait ya penyakit sepei asma te 
2021-01-02 15:22:38,Tonwart2,berdasarkan hasil swab reguler mingguan saya dinyatakan positif terinfeksi covid tidak ada gejala yang saya rasakan 
2021-01-02 15:22:36,_zuxhir23,vaksin covid fasa peama akan mula diagih dan disuntik kepada kira kira satu juta rakyat negara ini bermula bulan dep 
2021-01-02 15:22:35,reformas1mental,yg diperlukan publikasi itu hasil uji vaksin kemaren bukan hasil survei abal abal mana ada orang percaya dasar media od 
2021-01-02 15:22:33,wanpartyy,rusli kalau gue terus terang tunggu vaksin apa yang dibeli oleh sultan hassanal bolkiah yang dipeuan negeri brunei darussa 
2021-01-02 15:22:32,KanjengRatuAyu1,berdasarkan hasil swab reguler mingguan saya dinyatakan positif terinfeksi covid tidak ada gejala yang saya rasakan 
2021-01-02 15:22:30,CeeUNah,stein barusan saya buka aplikasi al qur an indonesia di android tiba tiba ada notifikasi begini kedua orang tua pembuat aplikasi 
2021-01-02 15:22:30,Lithshine,sebuah pesan yang beredar melalui whatsapp ini meresahkan disebutkan bahwa vaksin sinovac hanya untuk kelinci percoba 
2021-01-02 15:22:27,Sofeaaao_,ikea umum cawangannya di damansara ditutup mulai hari ini susulan beberapa kes positif covid dikesan dalam kalangan 
2021-01-02 15:22:27,awang_tahir,januari rakyat malaysia mula terima vaksin covid februari ini yang sahih di berita m 
2021-01-02 15:22:26,qusyyyaaairi_,ikea umum cawangannya di damansara ditutup mulai hari ini susulan beberapa kes positif covid dikesan dalam kalangan 
2021-01-02 15:22:26,AdindaNindya,stein barusan saya buka aplikasi al qur an indonesia di android tiba tiba ada notifikasi begini kedua orang tua pembuat aplikasi 
2021-01-02 15:22:25,txtdarianonimne,sebuah pesan yang beredar melalui whatsapp ini meresahkan disebutkan bahwa vaksin sinovac hanya untuk kelinci percoba 
2021-01-02 15:22:25,Joglosemarnews,sudah tenaga kesehatan indonesia wafat akibat covid hingga desember idi paling tinggi di asia lima besar di dunia 
2021-01-02 15:22:23,zuzuezai,mesyuarat khas jawatankuasa muzakarah majlis kebangsaan bagi hal ehwal ugama islam yang bersidang pada disember lalu mengamb 
2021-01-02 15:22:23,_unintendedadm,ikea damansara tutup pekerja sah covid 
2021-01-02 15:22:20,InvestorID,total kasus aktif covid sampai januari 
2021-01-02 15:22:20,DennaJeal,men mtakubali io covid vaccine idungwe kwa omuzigidi yenu 
2021-01-02 15:22:19,brsxhka,stein barusan saya buka aplikasi al qur an indonesia di android tiba tiba ada notifikasi begini kedua orang tua pembuat aplikasi 
2021-01-02 15:22:12,voushine,iya itu pasti tapi yg udah pernah di uji coba pake vaksin ini ga tau gimana jelas kondisinya setelah di suntikin vaksin ini i mean apakah ada efek samping kaya demam atau yg lainnya gitu
2021-01-02 15:22:09,ZikriAlif7,geger tulisan only for clinical trial di kemasan vaksin sinovac ini penjelasan zubairi djoerban 
2021-01-02 15:22:09,amimlolz,orang malaysia nak free from covid macam new zealand tapi kita buat perangai macam orang amerika masa pandemik pi pa 
2021-01-02 15:22:08,noerdiani2017,interpetasi hasil tes covid pada orang yg suda sembug dari covid 
2021-01-02 15:22:05,fanashamarudin,ajaib assalamualaikum semua insyallah pagi karang saya berniat nak bangun solat tahajjud nak berdoa agar result swab test cov 
