create at,username,tweet
2020-11-08 09:58:16,SheeraKe,rt widyarenee strategipemulihanekonomi naah setuju urgent bahas indonesia resesi dunia me
2020-11-08 09:58:06,SheeraKe,pemerintah jokowi serius membawa indonesia pandemi strategipemulihanekonomi andy nomicin arjuno ireng https t co flubqicgmy
2020-11-08 09:57:57,detikcom,muzani mengakui pilkada pelik pandemi pemerintah mengupayakan namanya vaksin ucapannya mpr ahmadmuzani https t co jbge w fp
2020-11-08 09:57:49,SheeraKe,undangan who menkes terawan pengakuan penghargaan dunia internasional pemerintah indonesia yg dinilai berhasil menekan penyebaran covid strategipemulihanekonomi garenghallu bunda ima https t co rn gbaux
2020-11-08 09:57:40,GlHindu,alfiarnimakhtaf binprananda maaf terkait agama terkait perang mempertahankan wilayah spt orde menjadikan aceh dom peduli agama mayor pemerintah pusat agama daerah yg memerdekakan ya kirim pasukan yg timor timur clear
2020-11-08 09:57:30,jjsengui,rt rizmaya mensos juliaribatubara mewakili pemerintah terima kasih mnc grup kepedu
2020-11-08 09:57:18,Aalembur,putra bangsa ketutup hati nya benci pemerintah jd ngawur bgt
2020-11-08 09:57:16,Berita_Corona,pemerintah pantau suspek corona ri november detiknews corona korona
2020-11-08 09:57:14,Berita_Corona,viral emak emak marahi petugas pasar corona akal akalan pemerintah https t co dmd sepsbe corona korona
2020-11-08 09:56:37,lycorise_blue,rt susantomulyono kunci tdl murah subsidi subsidi pemerintah dihapus merancang subsidi
2020-11-08 09:56:32,ariandiputra8,lanjutan konpers kepala bappenasri suharso m pemerintah mengistimewakan salah sektor kesehatan ekonomi yradianto antaresh https t co uus nlvolk
2020-11-08 09:56:13,faridism,mohmahfudmd hukum kekuasaan mejadikan partisipasi wn minim semoga pemerintah membatalkan uu ck
2020-11-08 09:56:07,shoumad8484,rt rizmaya mensos juliaribatubara mewakili pemerintah terima kasih mnc grup kepedu
2020-11-08 09:56:07,muhammadjimanto,rt hnurwahid pksejahtera ucapkan selamat deklarasi partai masyumi reborn berharap teman pks mengawal demokrasi mem
2020-11-08 09:55:50,BatikRiwa,rt sayidmachmoed konon mexico anggota parlemen antonio garcia pidato memakai pakaian rapat
2020-11-08 09:55:22,SUKARDI1959,rt mohmahfudmd fadli zon menkopolhukam sy sdh mencoba menghubungi teman yg dgn rizieq maksud sy membant
2020-11-08 09:55:08,eLHurryKoRn,rt rizmaya mensos juliaribatubara mewakili pemerintah terima kasih mnc grup kepedu
2020-11-08 09:54:52,syarifptk,rt tvonenews covid epidemiolog ui pemerintah ambisius genjot ekonomi akip tvone https t co iukky ztix
2020-11-08 09:54:46,Rahmat42340701,propaganda kelompok separatis dimentahkan pemerintah inggris tegasuntukmerahputih dukung otsus freewestpapua https t co hcxhrdi ea
2020-11-08 09:54:42,imcoolwoman,sygfess pengalihan isu gaksi pemerintah gadengerin aspirasi rakyat uu ciptaker udah disahkan aja
2020-11-08 09:54:14,CungkringYanto,rt sicepot percayaindonesiamaju optimis menang lawan kovid pandemi ekonomi bangkit pl
2020-11-08 09:54:12,nabilasyfs,catsnou collegemenfess gak kuota uin gak dpt kuota pemerintah gak dpt kuota kkn doang dptnya itupun gak tulisan uin ku coba berhusnudzon wkwk
2020-11-08 09:54:03,machbeach,ccicpolri harap maklum hoax yg pemerintah https t co iq vxdytci
2020-11-08 09:53:36,emptywjne,rt zaaenaall jek rosul ga dikasih kabar allah beliau overthinking allah kabar d
2020-11-08 09:53:03,LgVeder,rt widyarenee strategipemulihanekonomi naah setuju urgent bahas indonesia resesi dunia me
2020-11-08 09:52:39,SutanMantari2,rt dinihrdianti persoalkan indonesia resesi staf khusus kemenkeuri prastow pemerintah mjd penyan
2020-11-08 09:52:23,Aryprasetyo85,rt hantosuwono maksudnya pengecut coba berani dirikan partai gak pilih rakyat salahkan pemerintah
2020-11-08 09:51:50,Kiki39717339,rt andre rosiade anggota dpr andre rosiade mewanti wanti pln pemadaman listrik andre kampanye te
2020-11-08 09:51:45,SevenSeas87,rt h n n a rezim jkw memimpin alokasi anggaran digelontorkan pemerintah korps bhayangkara mengalami tren peningkatan
2020-11-08 09:51:37,Firmanokom,rt aiek channel hrsbikinistanamenggigil kepulangan rizieq shihab mahfud md pemerintah salah https t co xlgz sxo i
2020-11-08 09:51:13,BunDy4n4,christien meity yukk mari bantu pemerintah untk atasi pandemi mulas liat kadal posting video mulu
2020-11-08 09:51:00,askvicong,kemiri ted kho kalimat yg teknisnya yg ruwet butuh skala tahunan salahsatu yg krusial sidang rapat pemerintah parlemen dpr dprd disiarkan publik as inggris pake aja tvri
2020-11-08 09:50:53,DiniHrdianti,rt monologelly kepala perwakilan pbb un indonesia valeriejulliand menjalin kerjasama dgn pemerin
2020-11-08 09:49:28,Alief1Ba,rt tirtoid pemerintah pusat daerah pengelola wisata dianggap gagal menerapkan protokol kesehatan libur pan
2020-11-08 09:49:01,ArsipMedia25,rt dusrimulya pemerintah anteknya ngomong apapun ttg hrs silahkan pegangan keterangan dubes saudi indonesia
2020-11-08 09:48:54,rengga_asmara,rt chaterinee sertifikat halal gratis pemerintah umkm yg bergerak sektor makanan minuman optimis me
2020-11-08 09:48:50,orangdesadamai,rt seruanhl pertimbangan matang dibahas pemerintah terkait pembuatan uuck salah satunya mencegah perpindahan lap
2020-11-08 09:48:30,sitisisterceria,rt hermans memperbayak teman silaturahmi twitter mari bergabung rmp indonesia damai maju me
2020-11-08 09:47:57,orangdesadamai,rt gemilang omnibus law uu cipta kerja strategi pemerintah mengubah kondisi iklim usaha indonesia
2020-11-08 09:47:12,nasrularnas1,rt hukumdan mahfud md konteksnya pemerintah dst menkopolhukam minus wawasan perlindung
2020-11-08 09:47:00,Tantewendy1,mohmahfudmd perjanjian ekstradisi saudi indonesia tante pemerintah bersikap pasif beliau hukum
2020-11-08 09:46:52,007koteka,rt dinihrdianti persoalkan indonesia resesi staf khusus kemenkeuri prastow pemerintah mjd penyan
2020-11-08 09:46:52,IstiartyNovi,ustadtengkuzul tau stempel sertifikat halal mui skrng ditangan pemerintah smkn parah kbncian nih ustadz kpmrintah
2020-11-08 09:46:42,deardiarees,manusia superior memiliki peran kehidupan makhluk sih i just saw a news pemerintah denmark memusnahkan cerpelai diduga penyebab mutasi covid dugaan who state covid ga bermutasi jahat bgt asli
2020-11-08 09:46:39,kainama_mozes,detikcom gak pulang lu ditangkap pemerintah arab saudi digelandangkan indonesia
2020-11-08 09:46:11,ikoMd,rt agakarebaa arnold mononutu mantan rektor universitas hasanuddin unhas dinobatkan pemerintah republik indonesia pahla
2020-11-08 09:45:58,mtchoiri,jodibaskoro nuicemedia bergantung sudut pandang pemerintah fine fine aja berkendara pakai motor sport spidometernya dibatasi km jam gas jarumnya segitu gitu aja
2020-11-08 09:45:56,toebiltea,rt monologelly kepala perwakilan pbb un indonesia valeriejulliand menjalin kerjasama dgn pemerin
2020-11-08 09:45:48,rinaiombak,womanfeeds id non dokter nder pokoknya dokter biar bener ya harganya bervariasi sih tergantung tambel dimana kalo murah yah rs pemerintah puskesmas
2020-11-08 09:45:37,FerryExpose,rt sayidmachmoed konon mexico anggota parlemen antonio garcia pidato memakai pakaian rapat
2020-11-08 09:45:33,Cahkuwut,rt seruanhl optimis pemerintah mengatasi pandemi resesi percayaindonesiamaju optimis menang lawan kovi
2020-11-08 09:45:28,syofia1511,rt hasmi bakhtiar tolong jokowi tarik dubes jakarta gak paham tugas sbg dubes gak paham sikapnya m
2020-11-08 09:45:11,orangdesadamai,rt denni sauya kantor perwakilan pbb indonesia menjalin kerja dgn pemerintah swasta mencapai target penyebaran vaksin co
2020-11-08 09:45:04,richard_whn,jraharja raja wan wanrawan sosmedbw dikelola swasta dikuasai negara kemakmuran rakyat swasta kontrak pemerintah joint venture kso sharing saham dll
2020-11-08 09:45:00,Cahkuwut,rt ariestariico diapresiasi dipuji instansi pemerintah lainya bank dunia moody adb mengapre
2020-11-08 09:44:53,OLIGARKICK,ucxup sentilan sentilun yg bercandain politisi ga sefrontal tp programnya langsung bungkus semenjak yg tv pendukung pemerintah
2020-11-08 09:44:49,herroen,rt tirtoid pemerintah pusat daerah pengelola wisata dianggap gagal menerapkan protokol kesehatan libur pan
2020-11-08 09:44:40,hayyaalalfalah9,rt tirtoid pemerintah pusat daerah pengelola wisata dianggap gagal menerapkan protokol kesehatan libur pan
2020-11-08 09:44:20,orangdesadamai,rt b doel hasil survei terkait kinerja jokowi penanganan pandemi covid mayoritas masyarakat rasional
2020-11-08 09:44:16,HantoSuwono,maksudnya pengecut coba berani dirikan partai gak pilih rakyat salahkan pemerintah https t co kz zq oiz
2020-11-08 09:44:16,Alis_tora,rt hukumdan mahpud pemerintah menangkap kelompok yg merusuh merusak fasilitas proses penjemputan habib rizieq orang or
2020-11-08 09:44:13,Sangtiand,rt dinihrdianti persoalkan indonesia resesi staf khusus kemenkeuri prastow pemerintah mjd penyan
2020-11-08 09:44:12,orangdesadamai,rt b doel umkm roda perekonomian indonesia perkembanganya kta dukng berkat uu cipta
2020-11-08 09:44:02,HaerumanUman,rt abu waras gini gaes gatot nurmantyo bintang mahaputera pahlawan tujuannya yg ditakutkan pemerin
2020-11-08 09:43:51,SuwantoroEko,rt kiyai marufamin pemerintah anggaran rp triliun mempercepat transformasi digital penyelenggaraan pemerintah
2020-11-08 09:43:48,agama_nusantara,rt tirtoid pemerintah pusat daerah pengelola wisata dianggap gagal menerapkan protokol kesehatan libur pan
2020-11-08 09:43:42,Aly_fatho,rt robert moses berkah obl indonesia maju investormajukanbangsa dukungan masyarakat langkah kebijakan yg tempu pemer
2020-11-08 09:43:28,DistyaDira_,pemerintah aparat kepolisian nya gak berani apain habib gak tau sih nekat wait n see
2020-11-08 09:43:04,Chaterinee_08,rt jumianto rk laskar petamburan kecewa pulang malu dideportasi gagal pulang overstay bayan safar dikab
2020-11-08 09:43:01,BatikRiwa,rt crown abie investor dunia meng apresiasi langkah pemerintah memulihkan ekonomi omnibus law diyakini sala
2020-11-08 09:42:59,MarutoPrasanti,staf khusus menkeu yustinus prastowo menggarisbawahi kali pemerintah penyangga utama perekonomian market lumpuh lengkapnyauntuksemua strategipemulihanekonomi https t co ojvs cpy r
2020-11-08 09:42:54,AgusSup39011241,rt rizmaya ah sich asli gak percaya berita ginian dech serius drun kdrun benget pemerintah on the tr
2020-11-08 09:42:54,BacaDiBaBe,menko airlangga pemerintah berjuang keras tangani pengangguran airlanggahartarto tingkatpengangguran angkatankerja suhariyanto https t co fpxxhxfy https t co vpmr zonlg
2020-11-08 09:42:49,webeLaksono,rt keekeewww uu cipta kerja jg memperhatikan kelestarian lingkungan hidup dlm pasal ayat uu cipta kerja pemerin
2020-11-08 09:42:20,BarBaro5_,ndon isback resttycayah divhumas polri ccicpolri kemkominfo restyleseh lu tulus berniat mencegah lu fokus ketujuan mulya lu tegur media pemerintah teman sensiri salah tegur ngebela teman lu yg salah berseberangan tujuan lu yg ngeberantas penyebaran akun porno fikir
2020-11-08 09:42:03,Hilalmerdeka,rt mohmahfudmd fadli zon menkopolhukam sy sdh mencoba menghubungi teman yg dgn rizieq maksud sy membant
2020-11-08 09:41:27,ardyanaatmajaya,pemerintah provinsi jawabarat infobdg bandungklik bandungnewsinfo https t co i qf pndv
2020-11-08 09:41:27,militanvespa,rt quvvatt quiz asah felling mohonbantu vote rt tambahan utang pemerintah indonesia adala
2020-11-08 09:41:22,richard_whn,jraharja raja wan wanrawan sosmedbw uu migas penuh kepentingan oligarki putusan mk no bp migas dibubarkan pemerintah dpr membentuk bumn khusus menugaskan bumn mengelola hulu migas
2020-11-08 09:40:43,g_siahaan,porno bersatu giliran kritik pemerintah pecah belah
2020-11-08 09:40:39,AgusSup39011241,rt ch chotlmah tercatat indonesia negara dgn optimisme ekonomi yg dibandingkan negara kadrun gagal lg dar
2020-11-08 09:40:13,richard_whn,jraharja raja wan wanrawan sosmedbw durian runtuh fasilitas istimewa perpanjangan jabatan hakim hakim pensiun diperpanjang diduga dibalas keputusan hakim menguntungkan pemerintah dpr
2020-11-08 09:40:07,budiarto689,rt rizmaya menjaga tegaknya pancasila membuang sampah tempatnya just trust amp mendukung penu
2020-11-08 09:40:04,KontanNews,pemerintah genjot ekonomi kuartal iv https t co tmueha z pertumbuhanekonomi
2020-11-08 09:40:01,muhlizaa,rt rakyatjelatatv uangnya kebiasaan merugikan pelanggan susah sih manusia model
2020-11-08 09:39:55,NelfidaD,rt h n n a rezim jkw memimpin alokasi anggaran digelontorkan pemerintah korps bhayangkara mengalami tren peningkatan
2020-11-08 09:39:55,shfndgg,rt safiqzakin mahasiswa tugas pemerintah kepentingan rakyat dike
2020-11-08 09:39:43,Chaterinee_08,rt b doel umkm roda perekonomian indonesia perkembanganya kta dukng berkat uu cipta
2020-11-08 09:39:41,Hanifah933,rt mulanbilqis pemerintah membubarkan lembaga non struktural dimana pembubaran pengeluaran negara efisien ser
2020-11-08 09:39:39,ardyanaatmajaya,bantuan pemerintah profinsi uang rb sembako sampe hujan hujanan bejubel gaes bdgklik bandungnewsinfo https t co cmiyufhmjd
2020-11-08 09:39:36,YusufNew10,noh tangkepin buzerp yg suka sebar hoax pemerintah yg ubar janji alias ngehoax rakyat patroli https t co eon qw hd
2020-11-08 09:39:32,Chaterinee_08,rt b doel hasil survei terkait kinerja jokowi penanganan pandemi covid mayoritas masyarakat rasional
2020-11-08 09:39:27,wbpratama,rt firdzaradiany mas ainunnajib fauci nya indonesia epidemiologis yg saran pemerintah jd diskus
2020-11-08 09:39:17,jaymaholdtra,rt abu waras beredar klarifikasi ibhrs informasi sampah pemerintah indonesia pemerintahan kerajaan
2020-11-08 09:39:16,Hanifah933,rt mulanbilqis uu cipta kerja peluang rakyat mengelola hutan amp melindungi masyarakat adat uu cipta kerja
2020-11-08 09:39:01,03__nakula,rt socials nakula eizanfolks canda bisnis ellalia elnaan everadina mynaeve ekemarok edy soebekti amirhasanr
2020-11-08 09:38:40,molfina14,rt jazulijuwaini pro kontra bantuan hukum hrs pks pemerintah wajib lindungi wni https t co fy wg bxgg
2020-11-08 09:38:38,dirhand,rt tirtoid pemerintah pusat daerah pengelola wisata dianggap gagal menerapkan protokol kesehatan libur pan
