2020-12-27 15:36:44,erinadwii_, seorang jurnalis tempo yang menulis liputan terkait kasus korupsi bantuan sosial covid 19 mengalami upaya peretasan pada pons 
2020-12-27 15:36:43,HerUsing, aku no koment dah kalimat apa yg pantas buat ini juga termasuk yg mulut dan lidahnya gak bisa akur t co v 
2020-12-27 15:36:39,N_frhana, ya allah sedihnya moga pak cik terus kuat lawan covid 19 t co xuqictipb0
2020-12-27 15:36:35,pijott_, berikut adalah perincian 30 kes baharu covid 19 di negeri perak hari ini t co xscmwwcvt5
2020-12-27 15:36:29,amaliaarusli, ya allah sedihnya moga pak cik terus kuat lawan covid 19 t co xuqictipb0
2020-12-27 15:36:26,akmaleum, sehingga 27 disember jumlah kumulatif kes postif covid 19 dunia meningkat kepada 80 76 juta kes iaitu peambahan hampi 
2020-12-27 15:36:25,abdullah_rasy, sobat presiden meneg bumn jubir presiden staf khusus komunikasi kemeneg bumn mereka secara sadar beindak jadi en 
2020-12-27 15:36:14,nanayau, kerajaan masih kekalkan sekatan perjalanan ke negara kita untuk 23 negara termasuk united kingdom dari 7 september 2020 lagi 
2020-12-27 15:36:06,masakini_co,kasus sembuh pasien covid 19 beambah 6 389 orang secara nasional t co 7n0mzo5d3z
2020-12-27 15:36:02,jpnncom,gubernur jawa timur khofifah indar parawansa mengatakan kesiapannya menerima vaksin covid 19 sebagai bentuk komitmen dalam penanganan virus berbahaya tersebut khofifahindarparawansa t co 2ugcwqb2kc
2020-12-27 15:35:58,heru_pu2111, 084 kayak psbb transisi diperpanjang t co 0turpk6xip t co 0dfpmqhc55
2020-12-27 15:35:56,KangSumadi_, malam ini saya menghadiri perayaan natal nasional secara hybrid bersama menteri komunikasi dan informatika bapak jhonny 
2020-12-27 15:35:55,ftn_ain, lg takut masa prn sabah time tu pemimpin hilang ingatan semua gila kuasa sop ke laut selepas pada tu ke 
2020-12-27 15:35:53,ImranHanafi25, kerajaan masih kekalkan sekatan perjalanan ke negara kita untuk 23 negara termasuk united kingdom dari 7 september 2020 lagi 
2020-12-27 15:35:47,bleepblopbleeb2, fadhullah kita terpaksa buka ekonomi tiada guna sekat kehidupan rakyat asalkan semua patuh sop virus co 
2020-12-27 15:35:44,AnakKolong_, mari kita dukung wisata halal agar sektor pariwi 
2020-12-27 15:35:44,kuninggemilang, indonesia terburuk ketiga di planet bumi jategori kematian covid 19 per 1000 pop diantara negara dengan lebih 20juta p 
2020-12-27 15:35:43,h3nd4r, vaksin corona merah putih nantinya akan digunakan di indonesia sudah sejauh mana perkembangannya ini kabar baiknya vaksin 
2020-12-27 15:35:41,humaiiraa__, since i positive covid 19 during 38 weeks pregnant so this is my story hampa boleh baca untuk baca pengalaman or ambil as i 
2020-12-27 15:35:35,_Aimanxz, malaysia kekal di kedudukan ke 74 dalam kes covid 19 dunia iaitu lebih tinggi berbanding china singapura dan korea selat 
2020-12-27 15:35:34,theaceh_post, t co 31bovoptcc live streaming 16 tahun tsunami aceh refleksi tsunami amp kekuatan masyarakat aceh dalam menghadapi pandemi covid 19 bersama prof dr fauzi saleh t co bp8wy5xyfk lc m a zikir bersama tgk h jamhuri ramli sq ma 
2020-12-27 15:35:34,eliswija, mestinya cari menkes yg tinggal tancap gas bgs masih ngamanin vaksin dan gue yakin program lain cuman mampu meraba raba mi 
2020-12-27 15:35:34,kina_yuu, hi i nak cari sesiapa yg ingin co rent my office space kesan covid19 i have to cut cost jadi ada 4 desk kosong ni bukan of 
2020-12-27 15:35:29,RonaldLampard8, chotlmah dia di isolasi ko sepei rizieq masuk penjara ya dki baik2 aja kalo keluar pasti ada kegaduhan t co qtpds2ma 
2020-12-27 15:35:22,urfavchips, isi wag keluarga dan teman non dokter lagi ramai forward pesan sepei ini saya cuma mau ingatkan aja sebaiknya jika mengala 
2020-12-27 15:35:19,GL0BEWORLD, sobatkom dampak dan efek covid 19 masih terus diteliti belum ada kepastian bahwa penyintas yang telah pulih dari covid 1 
2020-12-27 15:35:16,YooRashi, isi wag keluarga dan teman non dokter lagi ramai forward pesan sepei ini saya cuma mau ingatkan aja sebaiknya jika mengala 
2020-12-27 15:35:15,madiunpunyakita, bersatulawancovid19 pakaimasker jagajarak cucitanganpakaisabun id indonesia tekan penyebaran covid 19 polsek manguharjo optimalkan ops yustisi di terminal purbaya madiun t co jdpnvk0ui7
2020-12-27 15:35:15,mediaindonesia,daerah siap distribusi vaksin satgascovid19 ingatpesanibu pakaimasker jagajarak jagajarakhindarikerumunan cucitangan cucitanganpakaisabun t co sq4ywzofxe
2020-12-27 15:35:14,hafizan_wahab, bebenang mengapa tak boleh umumkan harga vaksin situasi ini amat kompleks kita mesti mempeimbangkan hujah amp realiti 
2020-12-27 15:35:02,PakTua_Bertani, framing thd vaksin sinovac trus dilakukan oleh phk2 yg anti china berbagai celah dimanfaatkan utk mendiskreditkan kemam 
2020-12-27 15:34:59,izyanb_, hi i nak cari sesiapa yg ingin co rent my office space kesan covid19 i have to cut cost jadi ada 4 desk kosong ni bukan of 
2020-12-27 15:34:50,mediaindonesia,dalam sehari 328 pasien positif covid 19 di kebumen sembuh satgascovid19 ingatpesanibu pakaimasker jagajarak jagajarakhindarikerumunan cucitangan cucitanganpakaisabun t co wmq56xyrny
2020-12-27 15:34:41,_ddisorderr_, seorang jurnalis tempo yang menulis liputan terkait kasus korupsi bantuan sosial covid 19 mengalami upaya peretasan pada pons 
2020-12-27 15:34:38,mediaindonesia,tranmisi lokal picu lonjakan kasus covid 19 di babel satgascovid19 ingatpesanibu pakaimasker jagajarak jagajarakhindarikerumunan cucitangan cucitanganpakaisabun t co p1gxnqdwik
2020-12-27 15:34:36,fikriyahdarus, ya allah sedihnya moga pak cik terus kuat lawan covid 19 t co xuqictipb0
2020-12-27 15:34:33,aliffmaori2, kerajaan masih kekalkan sekatan perjalanan ke negara kita untuk 23 negara termasuk united kingdom dari 7 september 2020 lagi 
2020-12-27 15:34:28,shafiqarefiq, crimewatch pihak berkuasa sarawak sedang giat mengesan 2 lelaki indonesia yg menghilangkan diri selepas disahkan positif covid 19 
2020-12-27 15:34:28,cipley, isi wag keluarga dan teman non dokter lagi ramai forward pesan sepei ini saya cuma mau ingatkan aja sebaiknya jika mengala 
2020-12-27 15:34:27,FatkhanRofii, isi wag keluarga dan teman non dokter lagi ramai forward pesan sepei ini saya cuma mau ingatkan aja sebaiknya jika mengala 
2020-12-27 15:34:27,zico_alamsyah, indonesia terburuk ketiga di planet bumi jategori kematian covid 19 per 1000 pop diantara negara dengan lebih 20juta p 
2020-12-27 15:34:26,AdiHakim, indonesia update infografis percepatan penanganan covid 19 di indonesia per tanggal 27 desember 2020 pukul 12 00 wib bersatula 
2020-12-27 15:34:22,charlfu, hi i nak cari sesiapa yg ingin co rent my office space kesan covid19 i have to cut cost jadi ada 4 desk kosong ni bukan of 
2020-12-27 15:34:11,SoloSuara,presiden jokowi jangan kehilangan harapan perayaan natal di tengah pandemi covid 19 t co avtlniuxyn
2020-12-27 15:34:07,yapompiow, status terkini covid19 27 dis 2020 kes sembuh 997 jumlah kes sembuh 84 411 kes kes baharu positif 1 196 kes 1 191 
2020-12-27 15:34:03,ysminkhalil, bebenang mengapa tak boleh umumkan harga vaksin situasi ini amat kompleks kita mesti mempeimbangkan hujah amp realiti 
2020-12-27 15:34:02,myseekay, kerajaan masih kekalkan sekatan perjalanan ke negara kita untuk 23 negara termasuk united kingdom dari 7 september 2020 lagi 
2020-12-27 15:33:55,mediaindonesia,tingat kepercayaan masyarakat terhadap pemerintah dalam menyediakan vaksin sesuai kebutuhan satgascovid19 ingatpesanibu pakaimasker jagajarak jagajarakhindarikerumunan cucitangan cucitanganpakaisabun t co mwxvl8k3oa
2020-12-27 15:33:55,imwawaa, ya allah sedihnya moga pak cik terus kuat lawan covid 19 t co xuqictipb0
2020-12-27 15:33:55,GreySilver5, malam ini saya menghadiri perayaan natal nasional secara hybrid bersama menteri komunikasi dan informatika bapak jhonny 
2020-12-27 15:33:53,Melodya_TM, seorang jurnalis tempo yang menulis liputan terkait kasus korupsi bantuan sosial covid 19 mengalami upaya peretasan pada pons 
2020-12-27 15:33:49,rahfasolasido, per 26 desember sudah 4 7 juta dosis vaksin covid19 yg disuntikkan termasuk utk penduduk china indonesia msh menunggu 
2020-12-27 15:33:45,siroMC, kejutan perkiraan total kasus covid 19 indonesia hampir 4 juta kasus menggunakan analisa ifr mencapai 5 kali lipa 
2020-12-27 15:33:31,Mierul_Muhaimin, ya allah sedihnya moga pak cik terus kuat lawan covid 19 t co xuqictipb0
2020-12-27 15:33:30,dyanaaashudairi, ya allah sedihnya moga pak cik terus kuat lawan covid 19 t co xuqictipb0
2020-12-27 15:33:28,syafiqahhfaz, ya allah sedihnya moga pak cik terus kuat lawan covid 19 t co xuqictipb0
2020-12-27 15:33:27,BlueRos07, usah risau menerima beberapa vaksin dalam masa yang sama adalah selamat komunikasikita vaksincovid19 t co 
2020-12-27 15:33:25,joncaruak, nina08 tidak banyak beeriak inilah kontribusi muhammadiyah dalam penanganan covid 19 t co cyuclijec2
2020-12-27 15:33:19,helmyhad, status terkini covid19 27 dis 2020 kes sembuh 997 jumlah kes sembuh 84 411 kes kes baharu positif 1 196 kes 1 191 
2020-12-27 15:33:14,Granitaa_, sebulan yg lalu kucingku jg kena panleu pdhl vaksin udh lengkap kl sepengalamanku sih 2 jam sekali spet makanan i d hills minum kl dehidrasi minta infus aja sama kasih transfer factor
2020-12-27 15:33:03,TheKpopers_,junsu xia batalkan hari kedua konser online karena kekhawatiran covid 19 t co fha83qz3sg t co ctkvt3b4p4
2020-12-27 15:33:01,mirazh_me, mestinya cari menkes yg tinggal tancap gas bgs masih ngamanin vaksin dan gue yakin program lain cuman mampu meraba raba mi 
2020-12-27 15:32:56,thinkupmindaku, masa ni awal bulan feb 2020 kjaan yang sah adalah kjaan ph menteri kesihatan dr dzulkefly ahmad kes positif covid19 
2020-12-27 15:32:56,BlueRos07, statistik terkini covid 19 27 disember 2020 sumber jawatankuasa pengurusan bencana negeri sarawak covid19 kitateguhk 
2020-12-27 15:32:51,Nukha17, kalau ada yang kenal baik dengan beliau tolong disampaikan twit twit beliau ini sedang dijadikan bahan bakar oleh para pe 
2020-12-27 15:32:46,ivonne_lisungan, kalau tinggal di saudi apa ada yang berani bilang videokan dan jangan diedit bisa hilang sekejap 
2020-12-27 15:32:46,dwiiagus007, siapapun bisa terkena virus covid19 tanpa terkecuali bisa jadi orang di sekeliling anda berisiko tinggi menularkann 
2020-12-27 15:32:44,stevankresonia, sejak awal tahun 2020 ribuan dokter perawat epidemiolog peneliti dan tenaga kesehatan lain bekerja dalam senyap me 
2020-12-27 15:32:38,PMRLangkawi1, aku nak balik kampung tapi ahli keluarga semua berisiko tinggi lindungi diri dan keluarga adalah tanggungjawab anda 
2020-12-27 15:32:32,BlueRos07, kenyataan media jawatankuasa pengurusan bencana 3 kes covid 19 dikesan di sarawak hari ini covid19 janganlekadanalp 
2020-12-27 15:32:27,HasrulZulfadli, bebenang mengapa tak boleh umumkan harga vaksin situasi ini amat kompleks kita mesti mempeimbangkan hujah amp realiti 
2020-12-27 15:32:26,yahayuyaqayyum, bakkaniy banyak lagi perkara lain yang lagi penting untuk diambil tahu isu daging covid vaksin tu anak saya si fird 
2020-12-27 15:32:24,BruceKwaLee, kerajaan masih kekalkan sekatan perjalanan ke negara kita untuk 23 negara termasuk united kingdom dari 7 september 2020 lagi 
2020-12-27 15:32:22,PMRLangkawi1, kenyataan akhbar kpk 27 disember 2020 situasi semasa jangkitan penyakit coronavirus 2019 covid 19 di malaysia t c 
2020-12-27 15:32:21,SallehFahmi, hi i nak cari sesiapa yg ingin co rent my office space kesan covid19 i have to cut cost jadi ada 4 desk kosong ni bukan of 
2020-12-27 15:32:19,PMRLangkawi1, pergerakan 14 hari taburan kes covid 19 mengikut daerah di malaysia setakat 27 disember 2020 covid19 kitamestimenang 
2020-12-27 15:32:16,dnsharzl_, ya allah sedihnya moga pak cik terus kuat lawan covid 19 t co xuqictipb0
2020-12-27 15:32:14,arjuno_ireng01, chotlmah dia di isolasi ko sepei rizieq masuk penjara ya dki baik2 aja kalo keluar pasti ada kegaduhan t co qtpds2ma 
2020-12-27 15:32:13,fatinsabrina312, ya allah sedihnya moga pak cik terus kuat lawan covid 19 t co xuqictipb0
2020-12-27 15:32:12,kenyoooo, indonesia terburuk ketiga di planet bumi jategori kematian covid 19 per 1000 pop diantara negara dengan lebih 20juta p 
2020-12-27 15:32:10,MasihTuk, untuk daerah risiko tinggi pemerintah juga belum mengizinkan pembelajaran tatap muka t co ugzhurec5z
2020-12-27 15:32:02,Annisalaa_, terpopuler pemerintah indonesia didesak untuk mengaudit seluruh laboratorium yang melakukan tes pcr covid 19 menyusul 
2020-12-27 15:32:00,choacheIIa, jurnalis tempo mengalami upaya peretasan usai menulis liputan terkait kasus korupsi pembagian bansos covid 19 upaya peretasa 
2020-12-27 15:31:57,RudyEkoPurwant1, dataterbarucorona jumlah kasus positif di tanah air kini mencapai 713 365 kasus dengan tambahan 6 528 pasien kasus ke 
2020-12-27 15:31:52,wencod, isi wag keluarga dan teman non dokter lagi ramai forward pesan sepei ini saya cuma mau ingatkan aja sebaiknya jika mengala 
2020-12-27 15:31:45,rooqkie, jurnalis tempo mengalami upaya peretasan usai menulis liputan terkait kasus korupsi pembagian bansos covid 19 upaya peretasa 
2020-12-27 15:31:42,Shanmug8Matthew, hello ini bukan pasal daging tak tahu sembelihan ke tidak ini isu keselamatan tahu tak ada antara daging t 
2020-12-27 15:31:40,Ton56895905, isi wag keluarga dan teman non dokter lagi ramai forward pesan sepei ini saya cuma mau ingatkan aja sebaiknya jika mengala 
2020-12-27 15:31:33,ines_aryono, apa itu rapid test antigen covid 19 dan bagaimana mekanisme bekerjanya sebuah utas 
2020-12-27 15:31:32,ZaphioraB, seorang jurnalis tempo yang menulis liputan terkait kasus korupsi bantuan sosial covid 19 mengalami upaya peretasan pada pons 
2020-12-27 15:31:32,Cocotanfebriryn, yakan mumpung gratis dari pada booking hotel mending ngewe di wisma selain positif covid19 juga positif hiv atau hamil wah bagus ya banyak sisi positif nya
2020-12-27 15:31:24,humaiiraa__,risau la kes covid 19 banyak je lagi benda ni punya long term effect pun kita tak tahu seram tau kalau baca experience orang lain sampai loss sense of smell or taste nauzubillahiminzalik can we rely on vaccines 
2020-12-27 15:31:19,KuliBatuHitam, per 26 desember sudah 4 7 juta dosis vaksin covid19 yg disuntikkan termasuk utk penduduk china indonesia msh menunggu 
2020-12-27 15:31:18,Joglosemarnews,ini identitas 2 jenazah pasien positif covid 19 di sragen yang teukar padahal sudah terlanjur dimakamkan yang satu sudah kakek kakek 84 tahun satunya usia 74 tahun t co afqdqkwsga
2020-12-27 15:31:17,monitordaycom,selamat malam pemirsah covid 19 sdh sampai diteras rumah kita hadang jgn sampai masuk ke rmh kita tegakan 3m dan memohon kepada sang penguasa semesta agar pandemi cepat kelar 
2020-12-27 15:31:13,rhamdhanz1, viral di media sosial informasi minum minyak kayu putih bisa menyembuhkan covid 19 telah dipastikan bahwa informasi itu adal 
2020-12-27 15:31:12,vanhafiz7,geng anti vaksin ni taknak jadi geng anti memandu ke diorang guna data kematian disebabkan vaksin tapi tak sedar kematian daripada kemalangan pemanduan kereta lagi tinggi bila explain pasal aificial dengan organic chemica compound dalam vaccine dikatanya sesat 
2020-12-27 15:31:07,KodimKarangany1,kodim karanganyar minggu tanggal 27 desember 2020 pelda mutakin dan serka iskandar anggota koramil 16 colomadu melaksanakan patroli untuk pendisiplinan protokol kesehatan guna mencegah penyebaran covid 19 dengan sasaran warga masyarakat yang berada di pasar t co gra9slhncq
2020-12-27 15:31:02,vinonissa_ra, isi wag keluarga dan teman non dokter lagi ramai forward pesan sepei ini saya cuma mau ingatkan aja sebaiknya jika mengala 
2020-12-27 15:31:00,KodimKarangany1,kodim karanganyar minggu tanggal 27 desember 2020 pelda mutakin dan serka iskandar anggota koramil 16 colomadu melaksanakan patroli untuk pendisiplinan protokol kesehatan guna mencegah penyebaran covid 19 dengan sasaran warga masyarakat yang berada di pasar t co ibx1v6ua7s
2020-12-27 15:43:20,ShakirahZakria, kerajaan masih kekalkan sekatan perjalanan ke negara kita untuk 23 negara termasuk united kingdom dari 7 september 2020 lagi 
2020-12-27 15:43:20,Zaindamai, sobatkom dampak dan efek covid 19 masih terus diteliti belum ada kepastian bahwa penyintas yang telah pulih dari covid 1 
2020-12-27 15:43:19,nenengnos, peamina berkomitmen mendukung umkm untuk bangkit di masa pemulihan akibat terdampak pandemi covid 19 dengan menyalurkan ba 
2020-12-27 15:43:17,_chaijann, jurnalis tempo mengalami upaya peretasan usai menulis liputan terkait kasus korupsi pembagian bansos covid 19 upaya peretasa 
2020-12-27 15:43:12,septiadhiw, isi wag keluarga dan teman non dokter lagi ramai forward pesan sepei ini saya cuma mau ingatkan aja sebaiknya jika mengala 
2020-12-27 15:43:08,AMINULI14194739,status terkini covid19 27 dis 2020 kes sembuh 997 jumlah kes sembuh 84 411 kes kes baharu positif 1 196 kes 1 191 tempatan 5 impo jumlah positif 105 096 kes kes kematian 1 jumlah kes kematian 452 kes kes dirawat di icu 111 kes bantuan alat pernafasan 50 kes 
2020-12-27 15:42:58,KodimKarangany1,kodim karanganyar minggu tanggal 27 desember 2020 serda eko yulianto dan kopda joko susilo babinsa koramil 08 tawangmangu melaksanakan himbauan protokol kesehatan covid 19 di komplek pasar wisata tawangmangu amp rm bulakrejo di desa gondosuli kec tawangmangu 
2020-12-27 15:42:55,Tier2SwkCytro, bebenang mengapa tak boleh umumkan harga vaksin situasi ini amat kompleks kita mesti mempeimbangkan hujah amp realiti 
2020-12-27 15:42:54,SinarOnline,rekod itu menjadikan jumlah keseluruhan 606 kes positif covid19 terdapat di kelantan dengan 122 kes dalam rawatan termasuk tiga di icu sinarharian 
2020-12-27 15:42:53,KodimKarangany1,kodim karanganyar minggu tanggal 27 desember 2020 serda eko yulianto dan kopda joko susilo babinsa koramil 08 tawangmangu melaksanakan himbauan protokol kesehatan covid 19 di komplek pasar wisata tawangmangu amp rm bulakrejo di desa gondosuli kec tawangmangu 
2020-12-27 15:42:53,MrwanShazwan, kerajaan masih kekalkan sekatan perjalanan ke negara kita untuk 23 negara termasuk united kingdom dari 7 september 2020 lagi 
2020-12-27 15:42:51,Oncho0, sandi proritaskan vaksin corona untuk wisatawan nusantara 
2020-12-27 15:42:49,aerintan_, tolong diusut tuntas pak meresahkan sekali diduga pasien covid 19 melakukan hubungan intim dengan perawat nakes di w 
2020-12-27 15:42:43,Chameee_, hi i nak cari sesiapa yg ingin co rent my office space kesan covid19 i have to cut cost jadi ada 4 desk kosong ni bukan of 
2020-12-27 15:42:40,nh_nh_,13 kasus baru positif covid 19 ditemukan di aceh hari ini 
2020-12-27 15:42:39,vahlevirossi,13 kasus baru positif covid 19 ditemukan di aceh hari ini 
2020-12-27 15:42:38,ucokparta,13 kasus baru positif covid 19 ditemukan di aceh hari ini 
2020-12-27 15:42:37,_Shafrini, ya allah sedihnya moga pak cik terus kuat lawan covid 19 
2020-12-27 15:42:36,idalumintu, 234 kiyai dan tokoh nu meninggal dunia selama pandemi covid 19 
2020-12-27 15:42:36,aceh24,13 kasus baru positif covid 19 ditemukan di aceh hari ini 
2020-12-27 15:42:36,rzkynoor_, jtg rapid antigen menjadi syarat masuk ke jawa tengah hal ini merupakan salah satu upaya untuk menekan penyebaran covid 19 me 
2020-12-27 15:42:34,revanprtm, seorang jurnalis tempo yang menulis liputan terkait kasus korupsi bantuan sosial covid 19 mengalami upaya peretasan pada pons 
2020-12-27 15:42:32,acehkita,13 kasus baru positif covid 19 ditemukan di aceh hari ini 
2020-12-27 15:42:31,dindinast,ada yang datang ada yang pergi begitulah siklus kehidupan aku hanya ingin memberitahu bahwa covid 19 ini nyata covid 19 ini ada jujur setelah dengar kabar duka dari seorang yang aku kenal betul dan itu karna covid 19 baru kali ini aku berniat untuk lebih bermawas diri 
2020-12-27 15:42:29,Mar33Cj, chotlmah dia di isolasi ko sepei rizieq masuk penjara ya dki baik2 aja kalo keluar pasti ada kegaduhan 
2020-12-27 15:42:28,NewsRRIMedan,tidak khawatir covid 19 pengunjung padati pantai pandan lewat co id
2020-12-27 15:42:26,KockLuther, mari kita dukung wisata halal agar sektor pariwi 
2020-12-27 15:42:21,izzuddinzack, terkini sepanyol melaporkan 4 kes peama covid 19 dari jenis virus uk selain itu perancis dan lebanon juga turut masi 
2020-12-27 15:42:18,MackarlJervis, ale ale ale pengumuman penting warga asajaya dan sekitarnya ada dua kes positif covid 19 di kawasan asajaya masih 
2020-12-27 15:42:18,afiqahnorzaid, maasyaallah lengkawi kawan hantar foto ini semoga semua menjaga sop jika tidak kita akan hadapi masaalah besar dari lonjak 
2020-12-27 15:42:16,nuhasandra, ya allah sedihnya moga pak cik terus kuat lawan covid 19 
2020-12-27 15:42:10,TurnBackWahabi, senang akhirnya ada orang indonesia di indonesia yang bisa buat alat deteksi covid 19 bukan rakitan bukan p 
2020-12-27 15:42:08,newsrribogor,please help suppo vaksin untuk kita add a twibbon now 
2020-12-27 15:42:07,Ferry13602224, aku no koment dah kalimat apa yg pantas buat ini juga termasuk yg mulut dan lidahnya gak bisa akur 
2020-12-27 15:42:06,Mar33Cj, chotlmah id amis negative atau positive covid19 pencitraan kali 
2020-12-27 15:42:05,AmstrongBiring, sobatkom dampak dan efek covid 19 masih terus diteliti belum ada kepastian bahwa penyintas yang telah pulih dari covid 1 
2020-12-27 15:42:05,lilyyyprincess, dr bimbang kes covid 19 semakin meningkat di kelantan amp keselamatan orang tua yang berpenyakit 
2020-12-27 15:42:04,lutaibar2, kerajaan masih kekalkan sekatan perjalanan ke negara kita untuk 23 negara termasuk united kingdom dari 7 september 2020 lagi 
2020-12-27 15:42:00,1417ian, selama pandemi covid 19 sebanyak 234 kyai nu meninggal dunia 
2020-12-27 15:41:58,lvfiee, kerajaan masih kekalkan sekatan perjalanan ke negara kita untuk 23 negara termasuk united kingdom dari 7 september 2020 lagi 
2020-12-27 15:41:58,teslian4life, parut kenangan musim covid 19 ni saya tak perlu pemohonan maaf dari apa yang s 
2020-12-27 15:41:55,Nurussolichah3, utk vaksin merah putih bisa utk usia dibawah 18 thn dan diatas 58 kah 
2020-12-27 15:41:54,Syamsud76579252, kegiatan baik kerjasama dg rs pku muhamadiyah yogya temanya sehat dan sakit menurut agama islam ditujukan ke warga yg sed 
2020-12-27 15:41:48,beritamanado,berita terbaru cegah covid 19 pemkab mitra fokus jaga perbatasan kabupaten 
2020-12-27 15:41:48,akunsukas, jurnalis tempo mengalami upaya peretasan usai menulis liputan terkait kasus korupsi pembagian bansos covid 19 upaya peretasa 
2020-12-27 15:41:47,claudeniyibaho,ariko umenya covid 19 itoranya ndebera muri ay amatora yo centrafrica nta muntu numwe wambaye agapfukamunwa pe 
2020-12-27 15:41:45,izzaza_hshmh, bebenang mengapa tak boleh umumkan harga vaksin situasi ini amat kompleks kita mesti mempeimbangkan hujah amp realiti 
2020-12-27 15:41:43,erlindaputrii, ini serius alat baru dari ugm yg katanya mendeteksi covid19 lewat hembusan nafas masuk dlm peralatan anestesi diagnostik oleh k 
2020-12-27 15:41:43,danish_77777, kerajaan masih kekalkan sekatan perjalanan ke negara kita untuk 23 negara termasuk united kingdom dari 7 september 2020 lagi 
2020-12-27 15:41:42,FerlyJunandar, ke bali sekeluarga minggu lalu dan sekarang dia istri dan anak bungsunya positif covid 19 
2020-12-27 15:41:32,AmstrongBiring, kasus aktif covid 19 di jatim terus beambah bahkan menurut data satgas covid 19 jatim kasus aktif hanya dalam 25 hari me 
2020-12-27 15:41:28,globetrttr, status terkini covid19 27 dis 2020 kes sembuh 997 jumlah kes sembuh 84 411 kes kes baharu positif 1 196 kes 1 191 
2020-12-27 15:41:27,unfrhable, ya allah sedihnya moga pak cik terus kuat lawan covid 19 
2020-12-27 15:41:26,mediristanto, terserah masyarakat deh pake masker udh pada gamau kerumunan dimana2 trus skrg disalahin krn jadi bagian dari penyebab ke 
2020-12-27 15:41:24,AMINULI14194739, kerajaan masih kekalkan sekatan perjalanan ke negara kita untuk 23 negara termasuk united kingdom dari 7 september 2020 lagi 
2020-12-27 15:41:21,ddYanAzuL, hari ini terdapat tiga 3 kes positif covid 19 yang dikesan di daerah asajaya 2 dan kuching 1 ini menjadikan jumlah 
2020-12-27 15:41:19,eddydaud, parut kenangan musim covid 19 ni saya tak perlu pemohonan maaf dari apa yang s 
2020-12-27 15:41:11,verawaty_sinaga, 123 hi electrizen sekarang untuk cek token listrik gratis program stimulus covid 19 jadi makin mudah dengan pln mobile simak ca 
2020-12-27 15:41:11,AdinaArjun, innalillahi rsud brebes digeruduk massa peristiwa itu terjadi sekitar pukul 08 00 wib mereka datang untuk menjempu 
2020-12-27 15:41:02,NabilaShahirah1, bebenang 6 sebab mengapa perlukan pofolio vaksin drpd pelbagai syarikat bukan drpd satu sykt sahaja 1 tiada sykt yg 
2020-12-27 15:41:02,pmrmarang,1 kes kematian dilaporkan hari ini menjadikan jumlah kes kematian covid 19 di malaysia sebanyak 452 kkm mengucapkan takziah kepada ahli keluarga beliau pejabat penerangan daerah marang 
2020-12-27 15:41:02,anokpokciknasir, status terkini covid19 27 dis 2020 kes sembuh 997 jumlah kes sembuh 84 411 kes kes baharu positif 1 196 kes 1 191 
2020-12-27 15:40:59,Aishahsaleh__, maasyaallah lengkawi kawan hantar foto ini semoga semua menjaga sop jika tidak kita akan hadapi masaalah besar dari lonjak 
2020-12-27 15:40:57,aaiinnggg_, kerajaan masih kekalkan sekatan perjalanan ke negara kita untuk 23 negara termasuk united kingdom dari 7 september 2020 lagi 
2020-12-27 15:40:50,alienated_homan, setiap hari grup chat igd isinya cek cok mulu karena ya gimana lagi pasien covid 19 banyak kamar isolasi penuh lagi pasien 
2020-12-27 15:40:37,PoltCity, pembudayaan norma baharu dalam komuniti bagi mencegah penularan covid 19 cegahcovid19 kitajagakita patuhisop 
2020-12-27 15:40:36,KhaliffRusyaidi, banyak lagi perkara lain yang lagi penting untuk diambil tahu isu daging covid vaksin tu anak saya si firdaus 
